Manufacture,Type,Engine,Controllers,SPN,FMI,Code
Bell,Dump/Track Truck,Cummins/Mercedes,TCU,177,0,Transmission Oil Temperature Data Valid But Above Normal Operational Range - Most Severe Level
Bell,Dump/Track Truck,Cummins/Mercedes,TCU,177,2,Transmission Fluid Temperature Sensor Circuit Performance (P0711 )
Bell,Dump/Track Truck,Cummins/Mercedes,TCU,177,3,Transmission Fluid Temperature Sensor Circuit High (P0713)
Bell,Dump/Track Truck,Cummins/Mercedes,TCU,177,4,Transmission Fluid Temperature Sensor Circuit Low (P0712)
Bell,Dump/Track Truck,Cummins/Mercedes,TCU,177,15,RETARDER OIL TEMP
Bell,Dump/Track Truck,Cummins/Mercedes,TCU,190,2,Engine Speed Sensor Circuit Performance (P0726)
Bell,Dump/Track Truck,Cummins/Mercedes,TCU,190,14,Engine Speed Sensor Circuit (P0725)
Bell,Dump/Track Truck,Cummins/Mercedes,TCU,190,21,Engine Speed Sensor Circuit No Signal (P0727)
Bell,Dump/Track Truck,Cummins/Mercedes,TCU,191,2,Output Shaft Speed Sensor Circuit Performance (P0721)
Bell,Dump/Track Truck,Cummins/Mercedes,TCU,191,14,Output Shaft Speed Sensor Circuit (P0720)
Bell,Dump/Track Truck,Cummins/Mercedes,TCU,191,21,Output Shaft Speed Sensor Circuit No Signal (P0722)
Bell,Dump/Track Truck,Cummins/Mercedes,TCU,513,7,Torque Management Feedback Signal A (P2637) or Signal B (P2641)
Bell,Dump/Track Truck,Cummins/Mercedes,TCU,525,2,"Transmission Requested Gear-Erratic, Intermittent, or Incorrect"
Bell,Dump/Track Truck,Cummins/Mercedes,TCU,573,21,Torque Converter Clutch (TCC) System Stuck Off (P0741)
Bell,Dump/Track Truck,Cummins/Mercedes,TCU,597,2,Brake Switch Circuit (P0703)
Bell,Dump/Track Truck,Cummins/Mercedes,TCU,628,31,Control Module Random Access Memory (RAM) (P0604)
Bell,Dump/Track Truck,Cummins/Mercedes,TCU,630,13,TCM Not Programmed (P0602)
Bell,Dump/Track Truck,Cummins/Mercedes,TCU,740,3,Torque Converter Clutch (TCC) Pressure Control Solenoid (PCS) Control Circuit High (P2763)
Bell,Dump/Track Truck,Cummins/Mercedes,TCU,740,4,Torque Converter Clutch (TCC) Pressure Control Solenoid (PCS) Control Circuit Low (P2764)
Bell,Dump/Track Truck,Cummins/Mercedes,TCU,740,5,Torque Converter Clutch (TCC) Pressure Control Solenoid (PCS) Control Circuit/Open (P2761)
Bell,Dump/Track Truck,Cummins/Mercedes,TCU,747,31,Torque Control Data Mismatch - ECM/TCM (P0614)
Bell,Dump/Track Truck,Cummins/Mercedes,TCU,750,2,Turbine Shaft Speed Sensor Circuit Performance (P0716)
Bell,Dump/Track Truck,Cummins/Mercedes,TCU,750,14,Turbine Shaft Speed Sensor Circuit (P0715)
Bell,Dump/Track Truck,Cummins/Mercedes,TCU,750,21,Turbine Shaft Speed Sensor Circuit No Signal (P0717)
Bell,Dump/Track Truck,Cummins/Mercedes,TCU,751,2,Gear Shift Module 1 Invalid Data (U0404)
Bell,Dump/Track Truck,Cummins/Mercedes,TCU,751,8,Gear Shift Direction Circuit (P2793)
Bell,Dump/Track Truck,Cummins/Mercedes,TCU,751,9,Lost Communication with Gear Shift Module 1 (U0103)
Bell,Dump/Track Truck,Cummins/Mercedes,TCU,751,13,Gear Shift Module 1 Calibration Invalid (P1790)
Bell,Dump/Track Truck,Cummins/Mercedes,TCU,751,14,Transmission Range Sensor Circuit High (P0708)
Bell,Dump/Track Truck,Cummins/Mercedes,TCU,751,31,Gear Shift Module 1 Incompatible (U0304)
Bell,Dump/Track Truck,Cummins/Mercedes,TCU,752,2,Gear Shift Module 2 Invalid Data (U0592)
Bell,Dump/Track Truck,Cummins/Mercedes,TCU,752,9,Lost Communication with Gear Shift Module 2 (U0291)
Bell,Dump/Track Truck,Cummins/Mercedes,TCU,752,13,Gear Shift Module 2 Calibration Invalid (P1791)
Bell,Dump/Track Truck,Cummins/Mercedes,TCU,752,31,Gear Shift Module 2 Incompatible (U0333)
Bell,Dump/Track Truck,Cummins/Mercedes,TCU,753,2,General Purpose Input Fault (P071D)
Bell,Dump/Track Truck,Cummins/Mercedes,TCU,785,14,Transmission Control System Performance (P0701)
Bell,Dump/Track Truck,Cummins/Mercedes,TCU,837,2,Conditioned Output Shaft Speed Circuit (P1870 )
Bell,Dump/Track Truck,Cummins/Mercedes,TCU,880,3,"Stop Lamp Circuit (Red) Voltage Above Normal, Or Shorted To High Source"
Bell,Dump/Track Truck,Cummins/Mercedes,TCU,880,5,Stop Lamp Circuit (Red) Current Below Normal Or Open Circuit
Bell,Dump/Track Truck,Cummins/Mercedes,TCU,928,5,Axle Location Current Below Normal Or Open Circuit
Bell,Dump/Track Truck,Cummins/Mercedes,TCU,1716,3,Retarder Request Sensor Circuit High (C1313)
Bell,Dump/Track Truck,Cummins/Mercedes,TCU,1716,4,Retarder Request Sensor Circuit Low (C1312)
Bell,Dump/Track Truck,Cummins/Mercedes,TCU,2000,9,Lost Communications with ECM A (U0100)
Bell,Dump/Track Truck,Cummins/Mercedes,TCU,2003,11,Transmission Range Sensor Circuit Performance (P0706)
Bell,Dump/Track Truck,Cummins/Mercedes,TCU,2003,12,Control Module Performance (P0607)
Bell,Dump/Track Truck,Cummins/Mercedes,TCU,2003,31,GENERAL TRANSMISSION FAULT
Bell,Dump/Track Truck,Cummins/Mercedes,TCU,2796,2,Four Wheel Drive (4WD) Switch Circuit Range/Performance (P0837)
Bell,Dump/Track Truck,Cummins/Mercedes,TCU,2900,3,Crank Enable Circuit High (P081B)
Bell,Dump/Track Truck,Cummins/Mercedes,TCU,2900,4,Crank Enable Circuit Low (P081A )
Bell,Dump/Track Truck,Cummins/Mercedes,TCU,2908,2,Main Pressure Modulation Solenoid System Performance (P0961)
Bell,Dump/Track Truck,Cummins/Mercedes,TCU,2908,3,Main Pressure Modulation Solenoid Control Circuit High (P0963)
Bell,Dump/Track Truck,Cummins/Mercedes,TCU,2908,4,Main Pressure Modulation Solenoid Control Circuit Low (P0962)
Bell,Dump/Track Truck,Cummins/Mercedes,TCU,2908,5,Main Pressure Modulation Solenoid Control Circuit Open (P0960)
Bell,Dump/Track Truck,Cummins/Mercedes,TCU,3027,3,Transmission Fluid Level Sensor Circuit High (P070D)
Bell,Dump/Track Truck,Cummins/Mercedes,TCU,3027,4,Transmission Fluid Level Sensor Circuit Low (P070C)
Bell,Dump/Track Truck,Cummins/Mercedes,TCU,3359,1,Transmission Filter Maintenance Required (P088B)
Bell,Dump/Track Truck,Cummins/Mercedes,TCU,3359,16,Transmission Filter Maintenance Alert (P088A)
Bell,Dump/Track Truck,Cummins/Mercedes,TCU,3359,31,Transmission Service (Filter Life Monitor)
Bell,Dump/Track Truck,Cummins/Mercedes,TCU,3509,2,"Sensor Reference Voltage ""A"" Circuit (4) (P0642)"
Bell,Dump/Track Truck,Cummins/Mercedes,TCU,3509,3,"Sensor Reference Voltage ""A"" Circuit High (P0643 )"
Bell,Dump/Track Truck,Cummins/Mercedes,TCU,4177,1,Transmission Fluid Deteriorated (P0897)
Bell,Dump/Track Truck,Cummins/Mercedes,TCU,4177,17,Transmission Service (Oil Life Monitor)
Bell,Dump/Track Truck,Cummins/Mercedes,TCU,4178,31,Transmission Service (Transmission Health Monitor)
Bell,Dump/Track Truck,Cummins/Mercedes,TCU,5018,3,Sump Temperature sensor open circuit or voltage to High < 4.82 Volts
Bell,Dump/Track Truck,Cummins/Mercedes,TCU,5046,2,Shift selector signal fault
Bell,Dump/Track Truck,Cummins/Mercedes,TCU,5052,11,ECU system fault
Bell,Dump/Track Truck,Cummins/Mercedes,TCU,5055,2,Vehicle CAN fault
Bell,Dump/Track Truck,Cummins/Mercedes,TCU,5068,12,Central cut off fault
Bell,Dump/Track Truck,Cummins/Mercedes,TCU,5079,4,Operating voltage below limits
Bell,Dump/Track Truck,Cummins/Mercedes,TCU,5876,2,Incorrect Low Gear Ratio (P1739)
Bell,Dump/Track Truck,Cummins/Mercedes,TCU,5877,2,Incorrect 1st Gear Ratio (P0731)
Bell,Dump/Track Truck,Cummins/Mercedes,TCU,5878,2,Incorrect 2nd Gear Ratio (P0732)
Bell,Dump/Track Truck,Cummins/Mercedes,TCU,5879,2,Incorrect 3rd Gear Ratio (P0733)
Bell,Dump/Track Truck,Cummins/Mercedes,TCU,5880,2,Incorrect 4th Gear Ratio (P0734)
Bell,Dump/Track Truck,Cummins/Mercedes,TCU,5881,2,Incorrect 5th Gear Ratio (P0735)
Bell,Dump/Track Truck,Cummins/Mercedes,TCU,5882,2,Incorrect 6th Gear Ratio (P0729)
Bell,Dump/Track Truck,Cummins/Mercedes,TCU,5887,2,Incorrect Reverse Ratio (P0736)
Bell,Dump/Track Truck,Cummins/Mercedes,TCU,5888,2,Incorrect Reverse 2 Ratio (P077F)
Bell,Dump/Track Truck,Cummins/Mercedes,TCU,5891,3,Transmission Fluid Pressure Switch 1 Circuit High (P0843)
Bell,Dump/Track Truck,Cummins/Mercedes,TCU,5891,4,Transmission Fluid Pressure Switch 1 Circuit Low (P0842)
Bell,Dump/Track Truck,Cummins/Mercedes,TCU,5892,3,Transmission Fluid Pressure Switch 2 Circuit High (P0848)
Bell,Dump/Track Truck,Cummins/Mercedes,TCU,5892,4,Transmission Fluid Pressure Switch 2 Circuit Low (P0847)
Bell,Dump/Track Truck,Cummins/Mercedes,TCU,5893,3,Transmission Fluid Pressure Switch 3 Circuit High (P0873)
Bell,Dump/Track Truck,Cummins/Mercedes,TCU,5893,4,Transmission Fluid Pressure Switch 3 Circuit Low (P0872)
Bell,Dump/Track Truck,Cummins/Mercedes,TCU,5894,3,Transmission Fluid Pressure Switch 4 Circuit High (P0878)
Bell,Dump/Track Truck,Cummins/Mercedes,TCU,5894,4,Transmission Fluid Pressure Switch 4 Circuit Low (P0877)
Bell,Dump/Track Truck,Cummins/Mercedes,TCU,5900,3,Pressure Control Solenoid (PCS) 1 Control Circuit High (P2730)
Bell,Dump/Track Truck,Cummins/Mercedes,TCU,5900,4,Pressure Control Solenoid (PCS) 1 Control Circuit Low (P2729)
Bell,Dump/Track Truck,Cummins/Mercedes,TCU,5900,5,Pressure Control Solenoid (PCS) 1 Control Circuit Open (P2727)
Bell,Dump/Track Truck,Cummins/Mercedes,TCU,5900,20,Pressure Control Solenoid (PCS) 1 Stuck On (P2724)
Bell,Dump/Track Truck,Cummins/Mercedes,TCU,5900,21,Pressure Control Solenoid (PCS) 1 Stuck Off (P2723)
Bell,Dump/Track Truck,Cummins/Mercedes,TCU,5901,3,Pressure Control Solenoid (PCS) 2 Control Circuit High (P0967)
Bell,Dump/Track Truck,Cummins/Mercedes,TCU,5901,4,Pressure Control Solenoid (PCS) 2 Control Circuit Low (P0966)
Bell,Dump/Track Truck,Cummins/Mercedes,TCU,5901,5,Pressure Control Solenoid (PCS) 2 Control Circuit Open (P0964)
Bell,Dump/Track Truck,Cummins/Mercedes,TCU,5901,20,Pressure Control Solenoid (PCS) 2 Stuck On (P0777)
Bell,Dump/Track Truck,Cummins/Mercedes,TCU,5901,21,Pressure Control Solenoid (PCS) 2 Stuck Off (P0776)
Bell,Dump/Track Truck,Cummins/Mercedes,TCU,5902,3,Pressure Control Solenoid (PCS) 3 Control Circuit High (P0971)
Bell,Dump/Track Truck,Cummins/Mercedes,TCU,5902,4,Pressure Control Solenoid (PCS) 3 Control Circuit Low (P0970)
Bell,Dump/Track Truck,Cummins/Mercedes,TCU,5902,5,Pressure Control Solenoid (PCS) 3 Control Circuit Open (P0968)
Bell,Dump/Track Truck,Cummins/Mercedes,TCU,5902,20,Pressure Control Solenoid (PCS) 3 Stuck On (P0797)
Bell,Dump/Track Truck,Cummins/Mercedes,TCU,5902,21,Pressure Control Solenoid (PCS) 3 Stuck Off (P0796)
Bell,Dump/Track Truck,Cummins/Mercedes,TCU,5903,3,Pressure Control Solenoid (PCS) 4 Control Circuit High (P2721)
Bell,Dump/Track Truck,Cummins/Mercedes,TCU,5903,4,Pressure Control Solenoid (PCS) 4 Control Circuit Low (P2720)
Bell,Dump/Track Truck,Cummins/Mercedes,TCU,5903,5,Pressure Control Solenoid (PCS) 4 Control Circuit Open (P2718)
Bell,Dump/Track Truck,Cummins/Mercedes,TCU,5903,20,Pressure Control Solenoid (PCS) 4 Stuck On (P2715)
Bell,Dump/Track Truck,Cummins/Mercedes,TCU,5903,21,Pressure Control Solenoid (PCS) 4 Stuck Off (P2714)
Bell,Dump/Track Truck,Cummins/Mercedes,TCU,5904,3,Pressure Control Solenoid (PCS) 5 Control Circuit High (P2739)
Bell,Dump/Track Truck,Cummins/Mercedes,TCU,5904,4,Pressure Control Solenoid (PCS) 5 Control Circuit Low (P2738)
Bell,Dump/Track Truck,Cummins/Mercedes,TCU,5904,5,Pressure Control Solenoid (PCS) 5 Control Circuit Open (P2736)
Bell,Dump/Track Truck,Cummins/Mercedes,TCU,5905,3,Pressure Control Solenoid (PCS) 6 Control Circuit High (P2815)
Bell,Dump/Track Truck,Cummins/Mercedes,TCU,5905,4,Pressure Control Solenoid (PCS) 6 Control Circuit Low (P2814)
Bell,Dump/Track Truck,Cummins/Mercedes,TCU,5905,5,Pressure Control Solenoid (PCS) 6 Control Circuit Open (P2812)
Bell,Dump/Track Truck,Cummins/Mercedes,TCU,5905,20,Pressure Control Solenoid (PCS) 6 Stuck On (P2809)
Bell,Dump/Track Truck,Cummins/Mercedes,TCU,5905,21,Pressure Control Solenoid (PCS) 6 Stuck Off (P2808)
Bell,Dump/Track Truck,Cummins/Mercedes,TCU,5908,3,Shift Solenoid 1 Control Circuit High (P0974)
Bell,Dump/Track Truck,Cummins/Mercedes,TCU,5908,4,Shift Solenoid 1 Control Circuit Low (P0973)
Bell,Dump/Track Truck,Cummins/Mercedes,TCU,5908,5,Shift Solenoid 1 Control Circuit Open (P097A)
Bell,Dump/Track Truck,Cummins/Mercedes,TCU,5908,20,Shift Solenoid 1 Valve Performance - Stuck On (P0752)
Bell,Dump/Track Truck,Cummins/Mercedes,TCU,5908,21,Shift Solenoid 1 Valve Performance - Stuck Off (P0751)
Bell,Dump/Track Truck,Cummins/Mercedes,TCU,5909,3,Shift Solenoid 2 Control Circuit High (P0977)
Bell,Dump/Track Truck,Cummins/Mercedes,TCU,5909,4,Shift Solenoid 2 Control Circuit Low (P0976)
Bell,Dump/Track Truck,Cummins/Mercedes,TCU,5909,5,Shift Solenoid 2 Control Circuit Open (P097B)
Bell,Dump/Track Truck,Cummins/Mercedes,TCU,5909,20,Shift Solenoid 2 Valve Performance - Stuck On (P0757)
Bell,Dump/Track Truck,Cummins/Mercedes,TCU,5909,21,Shift Solenoid 2 Valve Performance - Stuck Off (P0756)
Bell,Dump/Track Truck,Cummins/Mercedes,TCU,5910,3,Shift Solenoid 3 Control Circuit High (P0980)
Bell,Dump/Track Truck,Cummins/Mercedes,TCU,5910,4,Shift Solenoid 3 Control Circuit Low (P0979)
Bell,Dump/Track Truck,Cummins/Mercedes,TCU,5910,5,Shift Solenoid 3 Control Circuit Open (P097C)
Bell,Dump/Track Truck,Cummins/Mercedes,TCU,5910,20,Shift Solenoid 3 Valve Performance - Stuck On (P0762)
Bell,Dump/Track Truck,Cummins/Mercedes,TCU,5910,21,Shift Solenoid 3 Valve Performance - Stuck Off (P0761)
Bell,Dump/Track Truck,Cummins/Mercedes,TCU,5912,0,TCM Internal Temperature Too High (P0634)
Bell,Dump/Track Truck,Cummins/Mercedes,TCU,6597,9,CAN Communication Bus 1 Off (U0073)
Bell,Dump/Track Truck,Cummins/Mercedes,TCU,6598,9,CAN Communication Bus 2 Off (U0074)
Bell,Dump/Track Truck,Cummins/Mercedes,TCU,6822,3,Actuator Supply Circuit Voltage 1 High (HSD 1) (P0659)
Bell,Dump/Track Truck,Cummins/Mercedes,TCU,6822,4,Actuator Supply Circuit Voltage 1 Low (HSD 1) (P0658)
Bell,Dump/Track Truck,Cummins/Mercedes,TCU,6822,5,Actuator Supply Circuit Voltage 1 Open (HSD 1) (P0657)
Bell,Dump/Track Truck,Cummins/Mercedes,TCU,6823,3,Actuator Supply Circuit Voltage 2 High (HSD 2) (P2671)
Bell,Dump/Track Truck,Cummins/Mercedes,TCU,6823,4,Actuator Supply Circuit Voltage 2 Low (HSD 2) (P2670)
Bell,Dump/Track Truck,Cummins/Mercedes,TCU,6823,5,Actuator Supply Circuit Voltage 2 Open (HSD 2) (P2669)
Bell,Dump/Track Truck,Cummins/Mercedes,TCU,6824,3,Actuator Supply Circuit Voltage 3 High (HSD 3) (P2686)
Bell,Dump/Track Truck,Cummins/Mercedes,TCU,6824,4,Actuator Supply Circuit Voltage 3 Low (HSD 3) (P2685)
Bell,Dump/Track Truck,Cummins/Mercedes,TCU,6824,5,Actuator Supply Circuit Voltage 3 Open (HSD 3) (P2684)
Bell,Dump/Track Truck,Cummins/Mercedes,TCU,8609,31,Transmission Software / Hardware Incompatible
Bell,Dump/Track Truck,Cummins/Mercedes,TCU,8621,31,Non-Volatile Memory (NVM) Error
Bell,Dump/Track Truck,Cummins/Mercedes,TCU,10012,1,Not system functions - it just shows up here because of the SPNs being in range
Bell,Dump/Track Truck,Cummins/Mercedes,TCU,18043,31,Not system functions - it just shows up here because of the SPNs being in range
Bell,Dump/Track Truck,Cummins/Mercedes,TCU,521231,31,Internal Control Module Keep Alive Memory Error (P0603 )
Bell,Dump/Track Truck,Cummins/Mercedes,CCU/OEU,75,0,Steering Axle Temperature Data Valid But Above Normal Operational Range - Most Severe Level
Bell,Dump/Track Truck,Cummins/Mercedes,CCU/OEU,97,4,WATER IN FUEL VOLTAGE BELOW NORMAL
Bell,Dump/Track Truck,Cummins/Mercedes,CCU/OEU,167,18,Alternator Potential (Voltage) Data Valid But Below Normal Operating Range - Moderately Severe Level
Bell,Dump/Track Truck,Cummins/Mercedes,CCU/OEU,444,18,Battery #2 Potential (Voltage) (see also 1376) Data Valid But Below Normal Operating Range - Moderately Severe Level
Bell,Dump/Track Truck,Cummins/Mercedes,CCU/OEU,578,0,Drive Axle Temperature Data Valid But Above Normal Operational Range - Most Severe Level
Bell,Dump/Track Truck,Cummins/Mercedes,CCU/OEU,628,12,Controller Is In Bootmode
Bell,Dump/Track Truck,Cummins/Mercedes,CCU/OEU,746,5,Differential Lock Solenoid Valve Current Below Normal Or Open Circuit
Bell,Dump/Track Truck,Cummins/Mercedes,CCU/OEU,1639,8,Fan Speed Abnormal Frequency Or Pulse Width Or Period
Bell,Dump/Track Truck,Cummins/Mercedes,CCU/OEU,2000,9,ECU CAN Comm Bad Update Rate
Bell,Dump/Track Truck,Cummins/Mercedes,CCU/OEU,2003,9,Loss of TCU CAN messages- Abnormal Update Rate
Bell,Dump/Track Truck,Cummins/Mercedes,CCU/OEU,2350,5,Lo Beam Headlight Current Low
Bell,Dump/Track Truck,Cummins/Mercedes,CCU/OEU,2350,6,Lo Beam Headlight Current High
Bell,Dump/Track Truck,Cummins/Mercedes,CCU/OEU,2355,5,Work Lights Current Low
Bell,Dump/Track Truck,Cummins/Mercedes,CCU/OEU,2355,6,Work Lights Voltage Low
Bell,Dump/Track Truck,Cummins/Mercedes,CCU/OEU,5000,0,Headlight dips left out of range high
Bell,Dump/Track Truck,Cummins/Mercedes,CCU/OEU,5000,1,Headlight dips left out of range low
Bell,Dump/Track Truck,Cummins/Mercedes,CCU/OEU,5000,2,Headlight dips left data erratic
Bell,Dump/Track Truck,Cummins/Mercedes,CCU/OEU,5000,3,Headlight dips left out of range short high
Bell,Dump/Track Truck,Cummins/Mercedes,CCU/OEU,5000,4,Headlight dips left out of range short low
Bell,Dump/Track Truck,Cummins/Mercedes,CCU/OEU,5000,5,Headlight dips left out of range open
Bell,Dump/Track Truck,Cummins/Mercedes,CCU/OEU,5000,6,Headlight dips left out of range ground
Bell,Dump/Track Truck,Cummins/Mercedes,CCU/OEU,5000,7,Headlight dips left mechanical failure
Bell,Dump/Track Truck,Cummins/Mercedes,CCU/OEU,5000,8,Headlight dips left abnormal frequency
Bell,Dump/Track Truck,Cummins/Mercedes,CCU/OEU,5000,9,Headlight dips left abnormal update rate
Bell,Dump/Track Truck,Cummins/Mercedes,CCU/OEU,5000,10,Headlight dips left abnormal rate change
Bell,Dump/Track Truck,Cummins/Mercedes,CCU/OEU,5000,11,Headlight dips left not valid
Bell,Dump/Track Truck,Cummins/Mercedes,CCU/OEU,5000,12,Headlight dips left in range
Bell,Dump/Track Truck,Cummins/Mercedes,CCU/OEU,5000,13,Headlight dips left out of calibration
Bell,Dump/Track Truck,Cummins/Mercedes,CCU/OEU,5000,14,Headlight dips left special instruction
Bell,Dump/Track Truck,Cummins/Mercedes,CCU/OEU,5000,15,Headlight dips left out of range high lo
Bell,Dump/Track Truck,Cummins/Mercedes,CCU/OEU,5000,16,Headlight dips left out of range high med
Bell,Dump/Track Truck,Cummins/Mercedes,CCU/OEU,5000,17,Headlight dips left out of range low lo
Bell,Dump/Track Truck,Cummins/Mercedes,CCU/OEU,5000,18,Headlight dips left out of range low med
Bell,Dump/Track Truck,Cummins/Mercedes,CCU/OEU,5000,19,Headlight dips left network data error
Bell,Dump/Track Truck,Cummins/Mercedes,CCU/OEU,5000,30,Headlight dips left data reset
Bell,Dump/Track Truck,Cummins/Mercedes,CCU/OEU,5000,31,Headlight dips left unknown
Bell,Dump/Track Truck,Cummins/Mercedes,CCU/OEU,5001,0,Headlight dips right out of range high
Bell,Dump/Track Truck,Cummins/Mercedes,CCU/OEU,5001,1,Headlight dips right out of range low
Bell,Dump/Track Truck,Cummins/Mercedes,CCU/OEU,5001,2,Headlight dips right data erratic
Bell,Dump/Track Truck,Cummins/Mercedes,CCU/OEU,5001,3,Headlight dips right out of range short high
Bell,Dump/Track Truck,Cummins/Mercedes,CCU/OEU,5001,4,Headlight dips right out of range short low
Bell,Dump/Track Truck,Cummins/Mercedes,CCU/OEU,5001,5,Headlight dips right out of range open
Bell,Dump/Track Truck,Cummins/Mercedes,CCU/OEU,5001,6,Headlight dips right out of range ground
Bell,Dump/Track Truck,Cummins/Mercedes,CCU/OEU,5001,7,Headlight dips right mechanical failure
Bell,Dump/Track Truck,Cummins/Mercedes,CCU/OEU,5001,8,Headlight dips right abnormal frequency
Bell,Dump/Track Truck,Cummins/Mercedes,CCU/OEU,5001,9,Headlight dips right abnormal update rate
Bell,Dump/Track Truck,Cummins/Mercedes,CCU/OEU,5001,10,Headlight dips right abnormal rate change
Bell,Dump/Track Truck,Cummins/Mercedes,CCU/OEU,5001,11,Headlight dips right not valid
Bell,Dump/Track Truck,Cummins/Mercedes,CCU/OEU,5001,12,Headlight dips right in range
Bell,Dump/Track Truck,Cummins/Mercedes,CCU/OEU,5001,13,Headlight dips right out of calibration
Bell,Dump/Track Truck,Cummins/Mercedes,CCU/OEU,5001,14,Headlight dips right special instruction
Bell,Dump/Track Truck,Cummins/Mercedes,CCU/OEU,5001,15,Headlight dips right out of range high lo
Bell,Dump/Track Truck,Cummins/Mercedes,CCU/OEU,5001,16,Headlight dips right out of range high med
Bell,Dump/Track Truck,Cummins/Mercedes,CCU/OEU,5001,17,Headlight dips right out of range low lo
Bell,Dump/Track Truck,Cummins/Mercedes,CCU/OEU,5001,18,Headlight dips right out of range low med
Bell,Dump/Track Truck,Cummins/Mercedes,CCU/OEU,5001,19,Headlight dips right network data error
Bell,Dump/Track Truck,Cummins/Mercedes,CCU/OEU,5001,30,Headlight dips right data reset
Bell,Dump/Track Truck,Cummins/Mercedes,CCU/OEU,5001,31,Headlight dips right unknown
Bell,Dump/Track Truck,Cummins/Mercedes,CCU/OEU,5002,0,J1C1; System Air Pressure Out Of Range High
Bell,Dump/Track Truck,Cummins/Mercedes,CCU/OEU,5002,1,J1C1; System Air Pressure Out Of Range Low
Bell,Dump/Track Truck,Cummins/Mercedes,CCU/OEU,5003,0,J1C2; Start Signal Out Of Range High
Bell,Dump/Track Truck,Cummins/Mercedes,CCU/OEU,5005,1,J1D1; Headlight Dash Switch Out Of Range Low
Bell,Dump/Track Truck,Cummins/Mercedes,CCU/OEU,5007,0,Reverse alarm out of range high
Bell,Dump/Track Truck,Cummins/Mercedes,CCU/OEU,5007,1,Reverse alarm out of range low
Bell,Dump/Track Truck,Cummins/Mercedes,CCU/OEU,5007,2,Reverse alarm data erratic
Bell,Dump/Track Truck,Cummins/Mercedes,CCU/OEU,5007,3,Reverse alarm out of range short high
Bell,Dump/Track Truck,Cummins/Mercedes,CCU/OEU,5007,4,Reverse alarm out of range short low
Bell,Dump/Track Truck,Cummins/Mercedes,CCU/OEU,5007,5,Reverse alarm out of range open
Bell,Dump/Track Truck,Cummins/Mercedes,CCU/OEU,5007,6,Reverse alarm out of range ground
Bell,Dump/Track Truck,Cummins/Mercedes,CCU/OEU,5007,7,Reverse alarm mechanical failure
Bell,Dump/Track Truck,Cummins/Mercedes,CCU/OEU,5007,8,Reverse alarm abnormal frequency
Bell,Dump/Track Truck,Cummins/Mercedes,CCU/OEU,5007,9,Reverse alarm abnormal update rate
Bell,Dump/Track Truck,Cummins/Mercedes,CCU/OEU,5007,10,Reverse alarm abnormal rate change
Bell,Dump/Track Truck,Cummins/Mercedes,CCU/OEU,5007,11,Reverse alarm not valid
Bell,Dump/Track Truck,Cummins/Mercedes,CCU/OEU,5007,12,Reverse alarm in range
Bell,Dump/Track Truck,Cummins/Mercedes,CCU/OEU,5007,13,Reverse alarm out of calibration
Bell,Dump/Track Truck,Cummins/Mercedes,CCU/OEU,5007,14,Reverse alarm special instruction
Bell,Dump/Track Truck,Cummins/Mercedes,CCU/OEU,5007,15,Reverse alarm out of range high lo
Bell,Dump/Track Truck,Cummins/Mercedes,CCU/OEU,5007,16,Reverse alarm out of range high med
Bell,Dump/Track Truck,Cummins/Mercedes,CCU/OEU,5007,17,Reverse alarm out of range low lo
Bell,Dump/Track Truck,Cummins/Mercedes,CCU/OEU,5007,18,Reverse alarm out of range low med
Bell,Dump/Track Truck,Cummins/Mercedes,CCU/OEU,5007,19,Reverse alarm network data error
Bell,Dump/Track Truck,Cummins/Mercedes,CCU/OEU,5007,30,Reverse alarm data reset
Bell,Dump/Track Truck,Cummins/Mercedes,CCU/OEU,5007,31,Reverse alarm unknown
Bell,Dump/Track Truck,Cummins/Mercedes,CCU/OEU,5009,1,J1E2; Four-Wheel Drive Dash Switch Out Of Range Low
Bell,Dump/Track Truck,Cummins/Mercedes,CCU/OEU,5010,0,Front lo speed out of range high
Bell,Dump/Track Truck,Cummins/Mercedes,CCU/OEU,5010,1,Front lo speed out of range low
Bell,Dump/Track Truck,Cummins/Mercedes,CCU/OEU,5010,2,Front lo speed data erratic
Bell,Dump/Track Truck,Cummins/Mercedes,CCU/OEU,5010,3,Front lo speed out of range short high
Bell,Dump/Track Truck,Cummins/Mercedes,CCU/OEU,5010,4,Front lo speed out of range short low
Bell,Dump/Track Truck,Cummins/Mercedes,CCU/OEU,5010,5,Front lo speed out of range open
Bell,Dump/Track Truck,Cummins/Mercedes,CCU/OEU,5010,6,Front lo speed out of range ground
Bell,Dump/Track Truck,Cummins/Mercedes,CCU/OEU,5010,7,Front lo speed mechanical failure
Bell,Dump/Track Truck,Cummins/Mercedes,CCU/OEU,5010,8,Front lo speed abnormal frequency
Bell,Dump/Track Truck,Cummins/Mercedes,CCU/OEU,5010,9,Front lo speed abnormal update rate
Bell,Dump/Track Truck,Cummins/Mercedes,CCU/OEU,5010,10,Front lo speed abnormal rate change
Bell,Dump/Track Truck,Cummins/Mercedes,CCU/OEU,5010,11,Front lo speed not valid
Bell,Dump/Track Truck,Cummins/Mercedes,CCU/OEU,5010,12,Front lo speed in range
Bell,Dump/Track Truck,Cummins/Mercedes,CCU/OEU,5010,13,Front lo speed out of calibration
Bell,Dump/Track Truck,Cummins/Mercedes,CCU/OEU,5010,14,Front lo speed special instruction
Bell,Dump/Track Truck,Cummins/Mercedes,CCU/OEU,5010,15,Front lo speed out of range high lo
Bell,Dump/Track Truck,Cummins/Mercedes,CCU/OEU,5010,16,Front lo speed out of range high med
Bell,Dump/Track Truck,Cummins/Mercedes,CCU/OEU,5010,17,Front lo speed out of range low lo
Bell,Dump/Track Truck,Cummins/Mercedes,CCU/OEU,5010,18,Front lo speed out of range low med
Bell,Dump/Track Truck,Cummins/Mercedes,CCU/OEU,5010,19,Front lo speed network data error
Bell,Dump/Track Truck,Cummins/Mercedes,CCU/OEU,5010,30,Front lo speed data reset
Bell,Dump/Track Truck,Cummins/Mercedes,CCU/OEU,5010,31,Front lo speed unknown
Bell,Dump/Track Truck,Cummins/Mercedes,CCU/OEU,5012,0,J1F2; Horn Switch Out Of Range High
Bell,Dump/Track Truck,Cummins/Mercedes,CCU/OEU,5013,0,Left front worklight out of range high
Bell,Dump/Track Truck,Cummins/Mercedes,CCU/OEU,5013,1,Left front worklight out of range low
Bell,Dump/Track Truck,Cummins/Mercedes,CCU/OEU,5013,2,Left front worklight data erratic
Bell,Dump/Track Truck,Cummins/Mercedes,CCU/OEU,5013,3,Left front worklight out of range short high
Bell,Dump/Track Truck,Cummins/Mercedes,CCU/OEU,5013,4,Left front worklight out of range short low
Bell,Dump/Track Truck,Cummins/Mercedes,CCU/OEU,5013,5,Left front worklight out of range open
Bell,Dump/Track Truck,Cummins/Mercedes,CCU/OEU,5013,6,Left front worklight out of range ground
Bell,Dump/Track Truck,Cummins/Mercedes,CCU/OEU,5013,7,Left front worklight mechanical failure
Bell,Dump/Track Truck,Cummins/Mercedes,CCU/OEU,5013,8,Left front worklight abnormal frequency
Bell,Dump/Track Truck,Cummins/Mercedes,CCU/OEU,5013,9,Left front worklight abnormal update rate
Bell,Dump/Track Truck,Cummins/Mercedes,CCU/OEU,5013,10,Left front worklight abnormal rate change
Bell,Dump/Track Truck,Cummins/Mercedes,CCU/OEU,5013,11,Left front worklight not valid
